{
  "schema_version": 2,
  "_note": "阈值策略对象（REQ-027）：每条规则的阈值选择方法、样本要求、降级回落与夹紧范围。method=absolute 等价于规则 rules.json 中原硬编码值（向后兼容）；method=relative_median 根据样本中位数 × multiplier 自适应。alerts 为全局健康度告警阈值（REQ-G-017）。",
  "alerts": {
    "override_rate_max": 0.5,
    "_note": "单规则推翻率 override_count/evaluated 超过该值 → override_rate_alert（warning）：说明规则先验与人工复核严重背离，需回看判据。"
  },
  "profiler": {
    "window_days": 20,
    "draft_overlap_min_ratio": 0.8,
    "value_sample_limit": 2000,
    "_note": "REQ-P-014/REQ-P-035 本体画像参数：window_days=时间窗覆盖指标锚点 ±N 天（AC 固化可配置，不硬编码）；draft_overlap_min_ratio=M6 草案候选关联阈值；value_sample_limit=值类型分布取样的 distinct 上限。"
  },
  "thresholds": [
    {
      "rule": "R1",
      "method": "absolute",
      "bound_param": "round_unit",
      "value": 10000,
      "fallback": 10000,
      "bounded_by": {"min": 1000, "max": 100000},
      "per": []
    },
    {
      "rule": "R2",
      "method": "absolute",
      "bound_param": "round_unit",
      "value": 10000,
      "fallback": 10000,
      "bounded_by": {"min": 1000, "max": 100000},
      "per": []
    },
    {
      "rule": "R3",
      "method": "relative_median",
      "bound_param": "absolute_threshold",
      "params": {"multiplier": 2.0, "min_samples": 20},
      "fallback": 30,
      "bounded_by": {"min": 5, "max": 1000},
      "per": ["subject"]
    },
    {
      "rule": "R4",
      "method": "absolute",
      "bound_param": "co_loc_window_days",
      "value": 1,
      "fallback": 1,
      "bounded_by": {"min": 1, "max": 7},
      "per": [],
      "_note": "R4 语义链接 lnk_co_located 已固化 ±1 天窗口；此处声明用于元数据，不直接注入 params"
    },
    {
      "rule": "R5",
      "method": "absolute",
      "bound_param": null,
      "value": null,
      "fallback": null,
      "bounded_by": null,
      "per": [],
      "_note": "R5 为知识包匹配，无数值阈值"
    },
    {
      "rule": "R6",
      "method": "absolute",
      "bound_param": "round_unit",
      "value": 10000,
      "fallback": 10000,
      "bounded_by": {"min": 1000, "max": 100000},
      "per": []
    }
  ]
}
